{
  "$schema": "https://json-schema.org/draft/2020-12/schema",
  "$id": "https://openset.dev/schema/v1/exercise-library.schema.json",
  "title": "OpenSet Exercise Library",
  "description": "Schema for validating OpenSet exercise library documents",
  "type": "object",
  "required": ["openset_version", "type", "id", "name", "version", "provider", "license", "exercises"],
  "properties": {
    "openset_version": { "type": "string", "pattern": "^1\\.[0-9]+$", "description": "OpenSet spec version" },
    "type": { "type": "string", "const": "exercise_library" },
    "id": { "type": "string" },
    "name": { "$ref": "#/$defs/LocalizedText" },
    "version": { "type": "string" },
    "provider": { "type": "string" },
    "license": { "type": "string" },
    "exercises": {
      "type": "array",
      "items": { "$ref": "#/$defs/Exercise" }
    }
  },
  "additionalProperties": false,
  "$defs": {
    "LocalizedText": {
      "description": "Free text, plain or keyed by BCP 47 locale code. Both forms are valid.",
      "oneOf": [
        { "type": "string" },
        {
          "type": "object",
          "minProperties": 1,
          "propertyNames": { "pattern": "^[A-Za-z]{2,3}(-[A-Za-z0-9]{2,8})*$" },
          "additionalProperties": { "type": "string" }
        }
      ]
    },
    "LocalizedTextList": {
      "description": "A list of strings, plain or keyed by BCP 47 locale code. Both forms are valid.",
      "oneOf": [
        { "type": "array", "items": { "type": "string" } },
        {
          "type": "object",
          "minProperties": 1,
          "propertyNames": { "pattern": "^[A-Za-z]{2,3}(-[A-Za-z0-9]{2,8})*$" },
          "additionalProperties": { "type": "array", "items": { "type": "string" } }
        }
      ]
    },
    "Exercise": {
      "type": "object",
      "required": ["id", "name", "common_dimensions"],
      "properties": {
        "id": {
          "type": "string",
          "pattern": "^[a-z][a-z0-9]*(_[a-z0-9]+)*$",
          "description": "Unique snake_case identifier within the library"
        },
        "name": { "$ref": "#/$defs/LocalizedText" },
        "aliases": { "$ref": "#/$defs/LocalizedTextList" },
        "description": { "$ref": "#/$defs/LocalizedText" },
        "body_part": {
          "type": "string",
          "enum": ["upper_body", "lower_body", "core", "full_body", "cardio"]
        },
        "body_parts": {
          "type": "array",
          "items": { "type": "string" },
          "description": "Optional finer taxonomy (e.g. chest, triceps); body_part remains primary"
        },
        "category": {
          "type": "string",
          "enum": ["push", "pull", "hinge", "squat", "carry", "rotation", "gait"]
        },
        "mechanic": {
          "type": "string",
          "enum": ["compound", "isolation"]
        },
        "laterality": {
          "type": "string",
          "enum": ["bilateral", "unilateral", "alternating"]
        },
        "level": {
          "type": "string",
          "enum": ["beginner", "intermediate", "advanced", "elite"]
        },
        "equipment": {
          "type": "array",
          "items": { "type": "string" }
        },
        "target_muscles": {
          "type": "array",
          "items": { "type": "string" }
        },
        "synergist_muscles": {
          "type": "array",
          "items": { "type": "string" }
        },
        "progressions": {
          "type": "array",
          "items": { "type": "string" },
          "description": "exercise_id refs to harder variations within the same library"
        },
        "regressions": {
          "type": "array",
          "items": { "type": "string" },
          "description": "exercise_id refs to easier variations within the same library"
        },
        "variations": {
          "type": "array",
          "items": { "type": "string" },
          "description": "exercise_id refs to lateral variations within the same library"
        },
        "sport_relevance": {
          "type": "array",
          "items": { "type": "string" }
        },
        "default_tempo": { "type": "string" },
        "common_dimensions": {
          "type": "array",
          "description": "Array of typical dimension combinations for this exercise. Each inner array lists the dimension names that define a common way to perform the exercise.",
          "items": {
            "type": "array",
            "items": {
              "type": "string",
              "enum": [
                "reps", "sides", "rounds", "load", "duration", "duration_per_side",
                "rest_between_sides", "tempo", "distance", "height", "incline",
                "pace", "speed", "power", "heart_rate", "heart_rate_zone",
                "rpe", "velocity", "calories", "cadence", "resistance"
              ]
            },
            "minItems": 1
          },
          "minItems": 1
        },
        "media": {
          "$ref": "#/$defs/Media"
        },
        "note": { "type": "string" }
      },
      "additionalProperties": false
    },
    "Media": {
      "type": "object",
      "properties": {
        "videos": {
          "type": "array",
          "items": {
            "type": "object",
            "required": ["url", "label"],
            "properties": {
              "url": { "type": "string", "format": "uri" },
              "label": { "type": "string" },
              "language": { "type": "string" }
            },
            "additionalProperties": false
          }
        },
        "photos": {
          "type": "array",
          "items": {
            "type": "object",
            "required": ["url", "label"],
            "properties": {
              "url": { "type": "string", "format": "uri" },
              "label": { "type": "string" }
            },
            "additionalProperties": false
          }
        },
        "animations": {
          "type": "array",
          "description": "Looping figure animations demonstrating the movement",
          "items": {
            "type": "object",
            "required": ["url", "label"],
            "properties": {
              "url": { "type": "string", "format": "uri" },
              "label": { "type": "string" },
              "format": { "type": "string", "description": "Container of the loop, e.g. apng, webp, gif, webm" },
              "fps": { "type": "number", "exclusiveMinimum": 0 },
              "loop": { "type": "boolean" }
            },
            "additionalProperties": false
          }
        }
      },
      "additionalProperties": false
    }
  }
}
